{
  "schemaVersion": 1,
  "eventId": "11111111-1111-4111-8111-111111111111",
  "sampleId": "22222222-2222-4222-8222-222222222222",
  "requestId": "fixture-request-1",
  "rolloutId": "33333333-3333-4333-8333-333333333333",
  "routeVersion": 1,
  "candidateDeploymentId": "candidate-v1",
  "requestedAt": "2026-08-12T00:00:00Z",
  "request": {
    "model": "support-assistant",
    "stream": false,
    "max_tokens": 128,
    "messages": [{ "role": "user", "content": "Synthetic fixture" }]
  }
}
